"ostim_id","sexlab_id","description"
"BakaDoggybound01-1","Babo_DoggyBound01_S1","{actor0} is kneeling, hands grasping {actor1}'s ass as she bends over, his fingers sensually groping her butt cheeks."
"BakaConquering04-1","Babo_Conquering04_S1","{actor0} is kneeling beside {actor1}, who is lying back, as he gently holds her leg, his hand wrapped around her calf."
"BakaDogeja01-1","Babo_Dogeja01_S1","{actor0} is kneeling, rubbing {actor1}'s clit with his hand as she bends over, her knees spread wide, also kneeling."
"BakaDogeja01-3","Babo_Dogeja01_S3","{actor0} is kneeling behind {actor1}, who is bent over on all fours, as he thrusts his cock into her pussy in a passionate vaginal sex act."
"BakaNecrolegspread-5","Babo_NecroLegSpread_S5","{actor0} is kneeling between {actor1}'s spread legs, holding one of her thighs as he thrusts his cock into her pussy, engaging in a passionate and intimate vaginal sex act."
"BakaConquering04-2","Babo_Conquering04_S2","{actor0} is kneeling behind {actor1}, who's lying on her side, as he bends over to sensually grope her butt with his hands."
"BakaDoggybound01-3","Babo_DoggyBound01_S3","{actor0} stands behind {actor1}, who's bent over, as he thrusts his dick into her pussy in a steamy vaginal sex act."
"BakaNecrolegspread02-5","Babo_NecroLegSpread02_S5","{actor0} is kneeling between {actor1}'s spread legs, holding her thigh as he thrusts his cock into her pussy, pounding her with a sensual rhythm."
"BakaFainted01-4","Babo_Fainted01_S4","{actor0} is kneeling between {actor1}'s legs as she lies back, his dick buried deep in her pussy as he fucks her, his fingers simultaneously rubbing her clit."
"Baka69-3","Babo_69_S3","{actor1} is sitting on top of {actor0}, who's lying back, with her vulva inches from his face as he performs cunnilingus with his lips on her, while simultaneously, she bends over to give him a blowjob, her mouth wrapped around his erect penis."
"BakaChairdildomf-1","Babo_ChairDildoMF_S1","{actor0} is standing, holding a sex toy and using it to tease {actor1}'s pussy as she sits, her legs spread apart to give him full access."
"BakaChockingrape01-2","Babo_ChockingRape01_S2","{actor0} is kneeling, thrusting his cock into {actor1}'s pussy as she lies on her front, facing away from him, her legs spread wide to accommodate his rhythmic motions."
"BakaChockingrape01-6","Babo_ChockingRape01_S6","{actor0} lies back as {actor1} straddles him, her vulva enveloping his cock in a passionate embrace. Meanwhile, {actor0}'s hand wraps around {actor1}'s neck, holding her in a firm but sensual grasp."
"BakaChokerape02-4","Babo_ChokeRape02_S4","{actor0} lies on his side, his hand sensually groping {actor1}'s breasts as she lies back, while his other hand rubs her clitoris, stimulating her vulva in a sexual manner."
"BakaChokerape02-5","Babo_ChokeRape02_S5","{actor0} is lying on his side, gently caressing {actor1}'s breasts with his hands, his touch sensual and intimate. At the same time, he's rubbing {actor1}'s clitoris with his hand, stimulating her vulva in a sexual and provocative way as she lies back, fully exposed."
"BakaChokerape03-5","Babo_ChokeRape03_S5","{actor0} is on all fours, bending over {actor1} who is lying back, holding her head in place as he thrusts his cock into her pussy in a passionate, sexual vaginal sex act."
"BakaChokerape03-1","Babo_ChokeRape03_S1","{actor0} is kneeling and bending over {actor1}, who is lying back, while he grips her neck tightly, his hand wrapped around her throat, as he pounds away, his stiff cock thrusting into her pussy."
"BakaChockingrape01-3","Babo_ChockingRape01_S3","{actor0} is kneeling between {actor1}'s legs as she lies on her front, facing away from him, her vulva exposed to him, while he thrusts his erect penis into her vagina, engaging in a passionate and intense vaginal sex act."
"BakaChockingrape01-4","Babo_ChockingRape01_S4","{actor0} is kneeling between {actor1}'s legs as she lies on her front, facing away from him, her body arched and exposed. He's thrusting his cock into her pussy while holding onto her arm, their bodies entwined in a passionate, primal rhythm."
"BakaConquering02-1","Babo_Conquering02_S1","{actor0} is standing over {actor1}, who is lying back, while he rubs her clitoris with his hand, delivering a sensual and intimate sexual touch to her vulva."
"BakaChockingrape01-5","Babo_ChockingRape01_S5","{actor0} lies on his back as {actor1} mounts him, her vulva engulfing his erect cock in a sensual act of vaginal sex. Meanwhile, {actor0} wraps his hand around {actor1}'s neck, gently holding her in place as they move in unison."
"BakaBmissionary-3","Babo_BMissionary_S3","{actor0} is kneeling and bent over, while {actor1} is lying back as he plunges his stiff cock into her wet pussy, pounding away in a passionate missionary-style pound."
"BakaBmissionary-2","Babo_BMissionary_S2","{actor0} is kneeling and bent over, while {actor1} is lying back, as {actor0} stimulates her vulva, rubbing her clitoris with his hand, sending erotic sensations through her body."
"BakaChokerape02-2","Babo_ChokeRape02_S2","{actor0} is standing, with one hand grasping {actor1}'s neck, while his other hand is busy rubbing {actor1}'s clit, getting her all riled up. {actor1} is standing, her neck gently restrained by {actor0}'s grip, as she receives the erotic stimulation."
"BakaChokerape02-3","Babo_ChokeRape02_S3","{actor0} is kneeling, gripping {actor1}'s neck as he buries his face in her chest, his fingers stroking her vulva, specifically rubbing her clitoris in a sensual, sexual motion, while {actor1} kneels across from him."
"BakaConquering-1","Babo_Conquering_S1","{actor0} is kneeling, rubbing {actor1}'s clitoris with his hand as he holds her body, while she kneels, her vulva exposed to his touch."
"BakaChokerape03-2","Babo_ChokeRape03_S2","{actor0} is kneeling beside {actor1}, who's lying back, as he gently holds her chin in a romantic gesture, his thumb tracing her jawline, while his other hand wraps around her neck, his fingers wrapped possessively around her throat."
"BakaConquering02-2","Babo_Conquering02_S2","{actor0} stands over {actor1}, who lies back, her body exposed and relaxed, as they share a moment of intimacy, his hard cock at attention, poised above her spread legs, her pussy glistening with anticipation."
"BakaDogeja01-2","Babo_Dogeja01_S2","{actor0} is kneeling behind {actor1}, who is also on her knees with her body bent over, as he slides his fingers into her vulva, stimulating her with a gentle yet intimate touch."
"BakaConquering04-5","Babo_Conquering04_S5","{actor0} lies on his side, his penis thrusting into {actor1}'s vulva as they engage in passionate vaginal sex. Meanwhile, {actor0} wraps his arms around {actor1}'s body, holding her close, and grasps her leg with one hand, his fingers wrapped tightly around her thigh as {actor1} lies on her side, her legs spread wide."
"BakaHaysleepfuck-3","Babo_HaySleepFuck_S3","{actor0} is kneeling, bent over, as he thrusts his cock into {actor1}'s pussy, who is lying back, receiving him in a passionate vaginal sex act."
"BakaChokerape03-4","Babo_ChokeRape03_S4","{actor0} is kneeling on all fours, bent over {actor1}, who is lying back, as he thrusts his cock into her pussy, engaging in intense vaginal sex."
"BakaConquering-4","Babo_Conquering_S4","{actor0} is kneeling between {actor1}'s legs as she lies back, his dick deeply penetrating her pussy in a passionate vaginal sex act, while he simultaneously has his hand wrapped tightly around her neck, holding her firmly in place."
"BakaConquering03-1","Babo_Conquering03_S1","{actor0} is standing, gripping {actor1}'s neck with his hand, while {actor1} is suspended in mid-air."
"BakaDrunkmf-1","Babo_DrunkMF_S1","{actor0} is standing, gripping {actor1}'s head, while {actor1} stands, her head being held by {actor0}."
"BakaDrunkmf-3","Babo_DrunkMF_S3","{actor0} is standing, holding {actor1}'s body and arm as they stand facing him."
"BakaFainted01-2","Babo_Fainted01_S2","{actor0} is kneeling beside {actor1}, who's lying back, as he gently holds her body and rubs her clit with his hand, stroking her mound in a sensual, sexual motion."
"BakaConquering04-3","Babo_Conquering04_S3","{actor0} lies on his side, his penis inside {actor1}'s vulva as they engage in passionate vaginal sex. At the same time, he wraps his arm around her body, holding her close as they move together in unison."
"BakaConquering04-4","Babo_Conquering04_S4","{actor0} and {actor1} are lying side by side, with {actor1} spreading her legs. They're engaged in a passionate session of vaginal sex, with {actor0} thrusting his stiff cock into {actor1}'s wet pussy. As they move in unison, {actor0} wraps his arms around {actor1}'s body, holding her close, while his hand also grips her leg, pulling it up to deepen the penetration."
"BakaDrunkmf-6","Babo_DrunkMF_S6","{actor0} is standing, clasping {actor1} tightly as they share a passionate, sensual kiss. At the same time, he's having sex with her, his dick thrusting into her pussy, while he gently holds her head in his hand."
"BakaDogeja01-4","Babo_Dogeja01_S4","{actor0} is kneeling behind {actor1}, who is also on her knees with her body bent over. He's thrusting his cock into her pussy while holding her arm, as they engage in a passionate kneeling sex position, her body arched and his body pressed against hers."
"BakaDrunkmf-5","Babo_DrunkMF_S5","{actor0} is standing, his erection buried deep in {actor1}'s pussy as they engage in a passionate, sensual kiss, their lips locked in a romantic embrace. Meanwhile, {actor0}'s hand is gently cradling {actor1}'s head, holding it in place as they devour each other's mouths."
"BakaHypnosisrape02-1","Babo_HypnosisRape02_S1","{actor0} stands, his eyes fixed on {actor1} as she stands facing away from him, her back to him, while he watches her."
"BakaChokerape03-3","Babo_ChokeRape03_S3","{actor0} is on all fours, bent over and kneeling, as he holds {actor1}'s neck with one hand. At the same time, he's having vigorous vaginal sex with {actor1}, who's lying back, his stiff cock thrusting into her wet pussy."
"BakaConquering-2","Babo_Conquering_S2","{actor0} is kneeling beside {actor1}, who's lying back with her legs apart, as he rubs her clit with his hand, sending waves of pleasure through her body, while his other hand gently cradles her head, holding it in place."
"BakaConquering03-3","Babo_BGConquering03_S3","{actor0} is kneeling and bent over, his dick thrusting into {actor1}'s pussy as she lies on her side, her legs wrapped around him."
"BakaDoggybound01-2","Babo_DoggyBound01_S2","{actor0} is kneeling in front of {actor1}, who is standing with her body bent over, as he performs oral sex on her, his mouth engulfing her vulva."
"BakaFainted01-5","Babo_Fainted01_S5","{actor0} stands, his dick thrusting into {actor1}'s pussy as they have sex. He's also got his arms around her, holding her body close."
"BakaConquering02-4","Babo_Conquering02_S4","{actor0} is lying on top of {actor1}, who is lying on her back, as he thrusts his dick into her pussy during a passionate vaginal sex session, all while holding onto her body with his hands."
"BakaConquering-3","Babo_Conquering_S3","{actor0} is kneeling, his penis thrusting into {actor1}'s vulva as she lies back, her legs wrapped around him. At the same time, he's got a firm grip on her neck, holding her in place as they engage in intense vaginal sex."
"BakaConquering03-5","Babo_Conquering03_S5","{actor0} is kneeling, bent over {actor1}, who is lying on her side, as he thrusts his cock into her pussy during a passionate, sensual kiss."
"BakaConquering03-4","Babo_Conquering03_S4","{actor0} is kneeling and bent over, his cock thrusting into {actor1}'s pussy as she lies on her side, her head held in place by his hand, her eyes locked on his as they engage in passionate vaginal sex."
"BakaConquering03-2","Babo_Conquering03_S2","{actor0} is on all fours, while {actor1} lies on her side, as he sensually gropes her butt with his hands."
"BakaConquering02-5","Babo_Conquering02_S5","{actor0} is lying on top of {actor1}, who is lying on her back, as he thrusts his cock into her pussy during a passionate bout of vaginal sex. Meanwhile, {actor0} wraps his arms around {actor1}'s body, holding her close as he continues to fuck her."
"BakaDogeja01-5","Babo_Dogeja01_S5","{actor0} is kneeling, his cock buried deep inside {actor1}'s pussy as they engage in passionate vaginal sex. At the same time, {actor0} wraps his hand around {actor1}'s arm, holding her close as they move in sync."
"BakaFainted02-2","Babo_Fainted02_S2","{actor0} is kneeling and bent over {actor1}, who's lying back, as he stimulates her vulva with his hand, rubbing her clitoris, while simultaneously licking her nipple with his mouth, sending shivers down her spine."
"BakaFallen01-3","Babo_Fallen01_S3","{actor0} kneels behind {actor1}, who's bent over, her knees folded under her, as he pounds away, his rigid shaft thrusting deep into her slick pussy in a frenzied session of vigorous vaginal sex."
"BakaHypnosisrape01-1","Babo_HypnosisRape01_S1","{actor0} is standing, watching as {actor1} stands before him, baring all."
"BakaKisssex-2","Babo_KissSex_S2","{actor0} and {actor1} stand facing each other, their lips locked in a sensual, romantic kiss as {actor0}'s hands wrap around {actor1}'s body, pulling her close."
"BakaMatingpress01-4","Babo_MatingPress01_S4","{actor0} is kneeling between {actor1}'s spread legs as she lies back, her vulva exposed. He's got a firm grip on her head while his penis plunges into her vagina, their bodies moving in sync as they engage in intense, passionate sex."
"BakaNecrolegspread-1","Babo_NecroLegSpread_S1","{actor0} is kneeling beside {actor1}, who's lying back with her legs spread wide, as he holds one of her legs and performs oral sex on her vulva, his mouth enveloping her moist flesh."
"BakaHypnosisrape01-5","Babo_HypnosisRape01_S5","{actor1} is kneeling over {actor0}, who's lying back, as they engage in passionate vaginal sex, with {actor0}'s cock thrusting into {actor1}'s pussy. Meanwhile, {actor1} gently holds her own head, lost in the moment."
"BakaChockingrape01-1","Babo_ChockingRape01_S1","{actor0} is kneeling behind {actor1}, who is lying on her front facing away from him, as he thrusts his cock into her pussy in a passionate vaginal sex act."
"Baka69-1","Babo_69_S1","{actor0} sits, his face buried between {actor1}'s legs as she stands over him, his mouth wrapped around her vulva, performing a sensual cunnilingus, his lips working her sensitive flesh."
"Baka69-2","Babo_69_S2","{actor1} is sitting on top of {actor0}, who is lying back, as he buries his face in her vulva, performing oral sex on her. His mouth is engulfed in her pussy, pleasing her with his lips."
"BakaConquering02-3","Babo_Conquering02_S3","{actor0} is lying on top of {actor1}, who's lying on her back, as they engage in a passionate vaginal sex act, with {actor0}'s stiff cock sliding in and out of {actor1}'s wet pussy."
"BakaChairdildomf-5","Babo_ChairDildoMF_S5","{actor0} is sitting, while {actor1} is sitting on top of him. {actor0} is holding a sex toy and using it to play with {actor1}'s vagina, as {actor1} simultaneously lowers herself onto {actor0}'s erect dick from behind, taking it deep into her ass."
"Baka69-5","Babo_69_S5","{actor0} lies back as {actor1} sits on top of him, bending over to take his cock deep into her mouth for a blowjob. At the same time, {actor0} buries his face in {actor1}'s vulva, performing cunnilingus with his lips and mouth, the two of them forming a 69 position."
"BakaDrunkmf-4","Babo_DrunkMF_S4","{actor0} and {actor1} are standing, locked in a romantic and sensual kiss. At the same time, {actor0}'s hand is busy rubbing {actor1}'s clit, a distinctly sexual touch that adds a erotic layer to their intimate moment."
"BakaFainted02-4","Babo_Fainted02_S4","{actor0} is kneeling and bent over {actor1}, who's lying back, as he holds her leg and thrusts his dick into her pussy during intense, passionate sex."
"BakaFainted02-5","Babo_Fainted02_S5","{actor0} is kneeling, bent over {actor1} who is lying back, holding her thigh as he thrusts his cock into her pussy during intense vaginal sex."
"BakaMatingpress01-1","Babo_MatingPress01_S1","{actor0} is kneeling, bent over, holding {actor1}'s leg as she lies back, her body arched in a sensual pose."
"BakaFainted02-1","Babo_Fainted02_S1","{actor0} is on all fours, his face buried between {actor1}'s legs as she lies back, his mouth devouring her vulva in a passionate oral sex act, pleasuring her with his lips and mouth."
"BakaKisssex-5","Babo_KissSex_S5","{actor0} stands, his erection buried deep within {actor1}'s pussy as he holds her leg, while {actor1} stands, her vulva wrapped around his shaft."
"BakaFallen01-2","Babo_Fallen01_S2","{actor0} is on his knees, grasping {actor1}'s curvy hips as she bends over, her knees also on the ground, her booty up in the air."
"BakaHaysleepfuck-2","Babo_HaySleepFuck_S2","{actor0} is sitting, while {actor1} is lying back as he thrusts his cock into her pussy in a passionate vaginal sex session."
"BakaHypnosisrape02-4","Babo_HypnosisRape02_S4","{actor0}, with his back against the surface, lies back as {actor1} kneels over him, her vulva engulfing his erect cock in a passionate bout of vaginal sex, while he wraps his hand around her arm, holding it tightly."
"BakaHypnosisrape02-3","Babo_HypnosisRape02_S3","{actor1} is kneeling over {actor0}, who's lying back, as they engage in a passionate vaginal sex act, with {actor0}'s penis thrusting into {actor1}'s vulva. Meanwhile, {actor1} gently cradles her own head with her hand, lost in the intensity of the moment."
"BakaMatingpress01-3","Babo_MatingPress01_S3","{actor0} kneels over {actor1}, who's lying back with her legs spread wide, as they share a sensual and romantic kiss. Meanwhile, {actor0}'s rock-hard cock plunges into {actor1}'s wet pussy, their sexual connection igniting a fierce passion between them."
"BakaMatingpress01-5","Babo_MatingPress01_S5","{actor0} is kneeling, holding {actor1}'s head as she lies back with her legs spread, while he thrusts his dick into her pussy in a passionate, sexual encounter."
"BakaHaysleepfuck-5","Babo_HaySleepFuck_S5","{actor0} lies on his side, his dick thrusting into {actor1}'s pussy as she lies back, her legs wrapped around him, both of them fully engaged in passionate vaginal sex."
"BakaNecrolegspread-4","Babo_NecroLegSpread_S4","{actor0} is kneeling between {actor1}'s spread legs, holding one of her legs in place as he thrusts his cock into her pussy, engaging in a passionate and intimate vaginal sex act."
"BakaHypnosisrape01-2","Babo_HypnosisRape01_S2","{actor0} stands witnessing the scene, his eyes fixed on {actor1} who is standing with her back to him, seemingly oblivious to his gaze, as she goes about her business."
"BakaHumanFmWallHub","\N","{actor0} and {actor1} stand facing the wall, their bodies almost touching, both of their feet planted firmly on the ground. The air is thick with anticipation as they wait for the moment to escalate into a passionate encounter."
"BakaKisssex-4","Babo_KissSex_S4","{actor0} stands facing {actor1}, his penis buried deep in her vulva as they engage in a passionate vaginal sex act. At the same time, he reaches around to grope her butt with his hands, adding a sensual touch to their intimate encounter."
"BakaNecrolegspread02-3","Babo_NecroLegSpread02_S3","{actor0} is on his knees, holding {actor1}'s leg as she lies back with her legs spread wide, while he thrusts his dick into her pussy in a passionate, sensual motion."
"BakaHypnosisrape01-3","Babo_HypnosisRape01_S3","{actor0} is kneeling, his hands sensually groping {actor1}'s breasts, while {actor1} is also on her knees, her hands busy with her own sex, pleasuring herself."
"BakaBmissionary-1","Babo_BMissionary_S1","{actor0} is kneeling and bent over, holding {actor1}'s leg as she lies back, her body arched in a sensual pose."
"BakaBackhugpressure01-3","Babo_BackHugPressure01_S3","{actor0} stands behind {actor1}, who is also standing, facing away from him. He holds her neck with one hand while thrusting his dick into her pussy from behind."
"BakaBmissionary-5","Babo_BMissionary_S5","{actor0} is kneeling and bent over, thrusting his cock into {actor1}'s pussy as she lies back, her legs wrapped around him in a missionary-style fuck."
"Baka69-4","Babo_69_S4","{actor0} lies back as {actor1} sits on top of him, bending over to suck his cock while he buries his face in her pussy, eating her out in a 69 position."
"BakaChairdildomf-2","Babo_ChairDildoMF_S2","{actor0} stands over {actor1}, who sits with her legs spread, as he teases her vulva with a sex toy, engaging in a sensual vaginal toying session."
"BakaBackhugpressure01-2","Babo_BackHugPressure01_S2","{actor0} is standing behind {actor1}, who is standing with her back to him, as he holds her body and neck, his hands possessively grasping her. At the same time, he's thrusting his cock into her pussy from behind, their bodies moving in a sensual rhythm during intercourse."
"BakaChairdildomf-3","Babo_ChairDildoMF_S3","{actor0} stands over {actor1} as she sits, her vulva exposed to him, and he uses a sex toy to stimulate her, skillfully teasing her labia and clit, bringing her immense pleasure."
"BakaChairdildomf-4","Babo_ChairDildoMF_S4","{actor0} is standing, bent over {actor1}, who is also standing with her ass bent over, as he thrusts his penis into her butt, simultaneously using a sex toy to stimulate her vagina, sending {actor1} into a frenzy of pleasure."
"BakaBackhugpressure01-5","Babo_BackHugPressure01_S5","{actor0} is standing behind {actor1}, who has her back to him, and is holding her neck as he plunges his stiff cock deep into her wet pussy from behind, their bodies Harrmoniously connected in a passionate, raw, and primal stance."
"BakaNecrolegspread02-1","Babo_NecroLegSpread02_S1","{actor0} stands while holding {actor1}'s neck, his hand firmly grasping her throat, as he simultaneously rubs her clit with his other hand, stimulating her vulva in a sensual and sexual manner, with {actor1} suspended in mid-air, her body at his mercy."
"BakaHaysleepfuck-4","Babo_HaySleepFuck_S4","{actor0} lies on his side, his stiff member sliding in and out of {actor1}'s pussy as she lies back, her legs wrapped around him."
"BakaNecrolegspread02-4","Babo_NecroLegSpread02_S4","{actor0} is kneeling between {actor1}'s spread legs, holding her thigh as he thrusts his cock into her pussy, their bodies moving in a sensual rhythm."
"BakaHaysleepfuck-1","Babo_HaySleepFuck_S1","{actor0} is on his knees, bent over, with his hand rubbing {actor1}'s clitoris, as she lies back, exposing her vulva, allowing him to stimulate her with his fingers."
"BakaPervertgroping01-1","Babo_PervertGroping01_S1","{actor0} stands behind {actor1}, who is standing with her back facing him, as he sensually gropes her butt with his hands."
"BakaQueen01-3","Babo_Queen01_S3","{actor0} lies back as {actor1} kneels beside him, gripping his shaft with her hand, stroking him in a sensual handjob."
"BakaNecrolongrape-1","Babo_NecroLongRape_S1","{actor0} is kneeling beside {actor1}, who's lying back, as he holds her head in place with one hand and uses the other to rub her clit, providing her with a sensual and intimate touch."
"BakaNecrolongrape-4","Babo_NecroLongRape_S4","{actor0} lies on his front, thrusting his dick into {actor1}, who is lying on her back with her legs wrapped around him, as they engage in passionate vaginal sex."
"BakaNecrolongrape-3","Babo_NecroLongRape_S3","{actor0} is lying on his front, while {actor1} is lying on her back. {actor0} is licking {actor1}'s nipple with his mouth, as he simultaneously thrusts his cock into her pussy, engaging in vaginal sex."
"BakaPervertgroping01-3","Babo_PervertGroping01_S3","{actor0} stands behind {actor1}, who is also standing but facing away from him, as he holds her head in place while thrusting his cock into her pussy from behind."
"BakaPervertgroping01-5","Babo_PervertGroping01_S5","{actor0} is standing, holding {actor1}'s head while she faces away from him, as he thrusts his cock into her pussy from behind in a passionate sexual encounter."
"BakaPervertgroping01-2","Babo_PervertGroping01_S2","{actor0} is standing behind {actor1}, who is also standing with her back to him, as he wraps his hand around her neck. At the same time, he reaches down to rub her clit, his fingers stroking her vulva in a sensual motion."
"BakaSneakyokestandingfuck-2","Babo_SneakYokeStandingFuck_S2","{actor0} stands behind {actor1}, who's facing away, as he sensually gropes her breasts with one hand and romantically holds her chin with the other."
"BakaSneakyokestandingfuck-4","Babo_SneakYokeStandingFuck_S4","{actor0} stands behind {actor1}, who is facing away from him, as he sensually gropes her breasts with one hand while holding the back of her neck with the other."
"BakaSneakyokestandingfuck-3","Babo_SneakYokeStandingFuck_S3","{actor0} stands behind {actor1}, who is also standing but facing away from him, as he sensually gropes her breasts with one hand while romantically holding her chin with the other."
"BakaPervertgroping01-4","Babo_PervertGroping01_S4","{actor0} is standing, holding {actor1}'s head as she stands facing away from him, her hips tilted back, while he thrusts into her from behind, his penis sliding in and out of her vulva in a smooth, sensual rhythm."
"BakaSneakyokestandingfuck-5","Babo_SneakYokeStandingFuck_S5","{actor0} stands behind {actor1}, who has her back to him, as he reaches around to sensually grope her breasts with one hand while using the other to gently hold her neck."
"BakaTabledoggyanal-1","Babo_TableDoggyAnal_S1","{actor0} is standing behind {actor1}, who's bent over with her back to him. He's sensually groping her butt with his hands."
