"ostim_id","sexlab_id","description"
"BakaWallleanpressure01-5","Babo_WallLeanPressure01_S5","{actor0} is standing with his erection buried deep inside {actor1}'s pussy as they groove against the wall, his hand gently holding her chin, their faces inches apart in a tender, romantic gesture."
"BakaWallleanpressure01-1","Babo_WallLeanPressure01_S1","{actor0} stands against the wall, holding {actor1}'s body, as she stands facing him, her body pressed against his."
"BakaStandingbound01-4","Babo_StandingBound01_S4","{actor0} stands, his hands sensually groping {actor1}'s butt and holding her head, while simultaneously thrusting his dick into her pussy from behind."
"BakaTabledoggyanal-2","Babo_TableDoggyAnal_S2","{actor0} is standing behind {actor1}, who is bent over and facing away from him, as he thrusts his cock into her pussy in a vigorous vaginal sex act."
"BakaStandingbound01-5","Babo_StandingBound01_S5","{actor0} is standing, and so is {actor1}. He's got one hand on her butt, groping her ass in a sensual way, while his other hand is holding her head. At the same time, he's buried deep inside her, his penis thrusting into her vulva as they engage in vigorous vaginal sex."
"BakaFallen01-1","Babo_Fallen01_S1","{actor0} is kneeling, watching intently as {actor1} kneels and bends over in front of him, her bare ass exposed."
"BakaFainted01-3","Babo_Fainted01_S3","{actor0} is kneeling beside {actor1}, who's lying back, as he gently holds her body and simultaneously rubs her clitoris with his hand, heightening her arousal."
"BakaNecrolongrape-5","Babo_NecroLongRape_S5","{actor0} is lying on his front, while {actor1} lies on her back beneath him, as they engage in a passionate vaginal sex act, with {actor0}'s penis deeply penetrating {actor1}'s vulva."
"BakaQueen01-4","Babo_Queen01_S4","{actor1} is kneeling over {actor0}, who is lying back, as she thrusts her cock into his pussy in a passionate sexual encounter."
"BakaSneakyokestandingfuck-1","Babo_SneakYokeStandingFuck_S1","{actor0} is standing, sensually groping {actor1}'s breasts with his hands while she stands opposite him."
"BakaStandingbound01-2","Babo_StandingBound01_S2","{actor1} stands tall while {actor0} kneels before her, his hand busily rubbing her clit, stimulating her vulva with a sensual touch."
"BakaWallleanpressure01-3","Babo_WallLeanPressure01_S3","{actor0} stands against the wall, his erect cock thrusting into {actor1}'s pussy as she stands facing him, her body pressed against his."
"BakaTabledoggyanal-4","Babo_TableDoggyAnal_S4","{actor0} is standing, his erection buried deep in {actor1}'s pussy as she stands facing away from him, her arm held securely in his grasp."
"BakaTabledoggyanal-5","Babo_TableDoggyAnal_S5","{actor0} stands behind {actor1}, who is facing away from him, as he thrusts his cock into her pussy, holding her arm with one hand and grasping her body with the other."
"BakaWallleanpressure01-2","Babo_WallLeanPressure01_S2","{actor0} is standing with his hand holding {actor1}'s body, and his fingers are rubbing {actor1}'s vulva, stimulating her clitoris, as she stands pressed against the wall. {actor1}'s chest is in full contact with the wall."
"BakaWallleanpressure01-4","Babo_WallLeanPressure01_S4","{actor0} stands against the wall, his dick thrusting into {actor1}'s pussy as they fuck in a passionate, sensual rhythm. At the same time, he gently holds {actor1}'s chin, a romantic gesture amidst the intensity of their lovemaking."
"BakaFainted02-3","Babo_Fainted02_S3","{actor0} is kneeling, bent over {actor1}, who is lying back, as he holds her leg in place and thrusts his cock into her pussy in a sensual, sexual rhythm."
"BakaFallen01-5","Babo_Fallen01_S5","{actor0} is kneeling behind {actor1} as she's on all fours, his shaft deeply penetrating her wet vulva in a passionate round of vaginal sex."
"BakaFallen01-4","Babo_Fallen01_S4","{actor0} is kneeling behind {actor1}, who is on all fours, as he plunges his stiff cock into her wet pussy, their bodies moving in sync in a passionate, sexual rhythm."
"BakaDoggybound01-5","Babo_DoggyBound01_S5","{actor0} is standing, fucking {actor1} from the front while she's also standing, his cock buried deep in her pussy. At the same time, he's rubbing her clit with his hand, stimulating her vulva as they engage in passionate sex."
"BakaHumanPage1","\N","{actor0} and {actor1} stand facing each other, both with their feet firmly on the ground, anticipating their next move, their bodies tense with expectation. The air is electric with anticipation as they wait for the right moment to take their desires to the next level."
"BakaQueen01-2","Babo_Queen01_S2","{actor1} is kneeling beside {actor0}, who's lying back, as she strokes his dick with her hand, giving him a handjob. Her fingers wrap around his shaft, moving up and down in a smooth, sensual motion."
"BakaStandingbound01-3","Babo_StandingBound01_S3","{actor0} is standing, groping {actor1}'s butt in a sensual manner with one hand, while using the other hand to gently hold {actor1}'s head, with {actor1} standing upright, her butt the focus of {actor0}'s attention."
"BakaQueen01-1","Babo_Queen01_S1","{actor0} is lying back, while {actor1} is standing over him, using her feet to work his cock in a sensual footjob, her toes expertly stroking his shaft as she pleasures him."
"BakaNecrolongrape-2","Babo_NecroLongRape_S2","{actor0} is lying on his front, while {actor1} is lying on her back, as he performs oral sex on her nipple with his mouth. At the same time, {actor0}'s dick is thrusting into {actor1}'s pussy, engaging in vaginal sex."
"BakaNecrolegspread02-2","Babo_NecroLegSpread02_S2","{actor0} is standing, grasping {actor1}'s neck, holding her in a suspended position, while his other hand is rubbing her clitoris, stimulating her vulva in a sexual manner."
"BakaHumanFmHub","\N","{actor0} and {actor1} stand facing each other, both with their feet firmly on the ground, their bodies tense with anticipation, ready to dive into their next intimate encounter. The air is thick with expectation as they wait for the moment to ignite their passion."
"BakaDoggybound01-4","Babo_DoggyBound01_S4","{actor0} stands facing {actor1}, his dick thrusting into her pussy as she stands with her legs apart, her vulva wrapped around his shaft in a sensual, sexual coupling."
"BakaHumanPage2","\N","{actor0} and {actor1} stand facing each other, anticipation radiating from their bodies as they wait for their next erotic encounter, {actor0}'s penis already stiff with arousal, while {actor1}'s pussy is wet with expectation."
"BakaStandingbound01-1","Babo_StandingBound01_S1","{actor0} stands facing {actor1}, his hands sensually groping her breasts as they stand together."
"BakaQueen01-5","Babo_Queen01_S5","{actor0} is lying back, while {actor1} is kneeling over him, their faces locked in a passionate, sensual kiss. At the same time, {actor1} is thrusting her cock into {actor0}'s pussy in a intense, sexual vaginal sex act."
"BakaKisssex-1","Babo_KissSex_S1","{actor0} and {actor1} are standing face-to-face, locked in a romantic and sensual kiss, their lips pressed together in a passionate embrace."
"BakaHypnosisrape02-2","Babo_HypnosisRape02_S2","{actor0} is kneeling, reaching out to {actor1} who is squatting with her back to him, and he's gently groping her breasts with a sensual touch. At the same time, his hand is also rubbing her clitoris, applying deliberate pressure in a sexual manner."
"BakaHypnosisrape02-5","Babo_HypnosisRape02_S5","{actor0} lies back as {actor1} kneels over him, his cock buried deep in her pussy as they engage in passionate vaginal sex, his hand grasping her leg for support."
"BakaMatingpress01-2","Babo_MatingPress01_S2","{actor0} is kneeling and bent over {actor1}, who is lying on her back, as he thrusts his cock into her pussy while gripping her neck with one hand."
"BakaTabledoggyanal-3","Babo_TableDoggyAnal_S3","{actor0} stands behind {actor1}, who is bent over with her back facing him, as he thrusts his cock into her pussy, holding onto her arm for leverage."
"BakaBackhugpressure01-1","Babo_BackHugPressure01_S1","{actor0} is standing, with his arms wrapped around {actor1}'s body, holding her from behind as she stands facing away from him, his hand also gently grasping the back of her neck."
"BakaNecrolegspread-2","Babo_NecroLegSpread_S2","{actor0} is kneeling between {actor1}'s spread legs, holding her leg as he thrusts his dick into her pussy, his movements slow and sensual as they engage in passionate vaginal sex."
"BakaNecrolegspread-3","Babo_NecroLegSpread_S3","{actor0} is kneeling between {actor1}'s spread legs, holding one of her thighs as he thrusts his cock into her pussy, his hips moving in a sensual rhythm as they engage in passionate vaginal sex."
"BakaBmissionary-4","Babo_BMissionary_S4","{actor0} is kneeling and bent over, thrusting his cock into {actor1}'s pussy as she lies back, receiving him in a missionary position, their bodies connected in a passionate, sexual union."
"BakaBackhugpressure01-4","Babo_BackHugPressure01_S4","{actor0} stands behind {actor1}, who is facing away, his hand grasping her neck as he thrusts his stiff cock into her vulva from behind, her body swaying to the rhythm of their intense, sensual fuck."
"BakaDrunkmf-2","Babo_DrunkMF_S2","{actor0} is standing, holding {actor1}'s head as she stands facing him."
"BakaHypnosisrape01-4","Babo_HypnosisRape01_S4","{actor1} is kneeling over {actor0}, who's lying back, as they engage in a passionate vaginal sex act, with {actor0}'s cock buried deep within {actor1}'s pussy, meanwhile {actor1} gently holds her own head, lost in the moment."
"BakaChokerape02-1","Babo_ChokeRape02_S1","{actor0} stands facing {actor1}, his hand grasping her neck, as she stands before him."
"BakaFainted01-1","Babo_Fainted01_S1","{actor0} kneels beside {actor1}, who lies back, as he sensually gropes her breasts with one hand while using the other to gently hold her body."
"BakaKisssex-3","Babo_KissSex_S3","{actor0} stands facing {actor1}, his cock buried deep inside her pussy as they engage in a passionate fuck. Meanwhile, he reaches around to grope her ass, squeezing her cheeks as they stand there entwined."
"BakaHumanPage3","\N","{actor0} and {actor1} stand facing each other, both with their feet firmly on the ground, their bodies poised in anticipation of what's to come, their eyes locked in a lustful gaze. The air is electric with tension as they eagerly await their next erotic encounter."
