"ostim_id","sexlab_id","description"
"MilkyWallbehind1-5","milky_wallbehind1_S5","{actor0} stands with his back against the wall, his cock buried deep in {actor1}'s pussy as she stands facing away from him, her hips pressed against his. He grasps her hip with one hand, holding her in place, while she wraps her arm around him, her hand clinging to his arm, their bodies entwined in a passionate, milky embrace."
"MilkyTable1-2","milky_alchemytable1_S2","{actor0} stands over {actor1}, who lies back with her legs spread wide, as he thrusts his cock into her pussy in a sensual missionary position. At the same time, he holds her body close, while she wraps her hand around his arm, pulling him deeper into her."
"MilkyStool1-4","milky_stool1_S4","{actor0} stands over {actor1}, who sits with her back to him, as he penetrates her anus with his cock, simultaneously grasping her arm with his hand."
"MilkyTable2-5","milky_alchemytable2_S5","{actor0} is standing, pounding into {actor1} from behind as she bends over, her vulva enveloping his shaft in a milky wetness. He grasps her body with one hand and holds her arm with the other, controlling the tempo of their intense vaginal sex."
"MilkyPage4","\N","{actor0} and {actor1} stand facing each other, both with their feet planted firmly on the ground, their bodies tense with anticipation as they await the next move in their carnal encounter."
"MilkyDoggy3-2","milky_doggy3_S2","{actor0} is kneeling behind {actor1}, who's on all fours, as he thrusts his cock into her pussy from behind in a doggy-style position, holding onto her body for leverage."
"MilkyDoggy3-4","milky_doggy3_S4","{actor0} is kneeling behind {actor1}, who is also on her knees, as he thrusts his penis into her vulva in a doggy style position, holding onto her arm with one hand."
"MilkyMissionary1-5","milky_missionary_1_S5","{actor0} is kneeling beside {actor1}, who is lying back, as he strokes his own shaft in a sensual motion, his hand moving up and down his erection. At the same time, he's gently holding {actor1}'s leg, his fingers wrapped around her calf."
"MilkySthrone1-4","milky_sthrone1_S4","{actor0} stands over {actor1}, who lies back with her legs spread wide, as he thrusts his cock into her pussy in a classic missionary position, holding her leg in place with one hand."
"MilkyBed2-5","milky_bed2_S5","{actor0} is kneeling behind {actor1}, who's on all fours, as he pounds her from behind in a passionate doggy-style position, his hands grasping her hips tight. His hard cock is deeply thrusting into her juicy vulva, sparking intense pleasure."
"MilkyCunnilingus1-2","milky_cunnilingus1_S2","{actor0} lies back as {actor1} kneels over him, her hand wrapped around his shaft, stroking it with a gentle yet sensual handjob, while their hands intertwine in a tender holding of hands, filling the air with a sense of romance and intimacy."
"MilkyBed3-5","milky_bed3_S5","{actor1} straddles {actor0}, riding him in a sensual cowgirl position. {actor0} lies back, holding one of {actor1}'s legs as she bounces up and down, his penis deep inside her vulva, while {actor1} grasps his torso, their bodies moving in sync."
"MilkyAlchemytable1-4","milky_alchemytable1_S4","{actor0} is standing behind {actor1}, who is bent over with her legs spread, as he takes her from behind in a doggy style position, his penis deeply penetrating her vulva. At the same time, {actor0} has a firm grip on {actor1}'s leg, holding it in place as they engage in passionate vaginal sex."
"MilkyCowgirl2-5","milky_cowgirl2_S5","{actor1} is sitting on top of {actor0}, riding him in a cowgirl position as they engage in passionate vaginal sex, her vulva enveloping his throbbing cock. Meanwhile, {actor0} is lying back, holding onto {actor1}'s leg with one hand, while {actor1} is grasping {actor0}'s leg with her hand, their bodies moving in perfect sync."
"MilkyBed1-5","milky_bed1_S5","{actor0} is standing over {actor1}, who is lying back, as he plunges his erection into her pussy in a passionate missionary position, their bodies locked in a frenzied, sultry dance."
"MilkyLaying1-4","milky_laying1_S4","{actor0} is kneeling, thrusting his cock into {actor1}'s pussy as she lies on her front, while he wraps his arms around her body, holding her close."
"MilkyBench2-2","milky_bench2_S2","{actor0} is standing with his body bent over, his hand slipping between {actor1}'s legs as he finger-fucks her vulva, his other hand gripping her head. At the same time, {actor1} lies back, her hand wrapped around {actor0}'s arm, her eyes locked on his face as she moans with pleasure."
"MilkyBed2-1","milky_bed2_S1","{actor0} is kneeling behind {actor1}, who's on all fours, as he rubs her vulva with one hand, bringing her to a state of arousal, while his other hand holds onto her hip, adding a romantic touch to the intense moment."
"MilkyAlchemytable1-1","milky_alchemytable1_S1","{actor0} stands as he strokes his cock, simultaneously grasping {actor1}'s hip as she bends over in front of him, her body arched in a vulnerable position."
"MilkyAlchemytable2-3","milky_alchemytable2_S3","{actor0} is sitting between {actor1}'s legs as she lies back, his cock deeply entrenched in her pussy as they engage in a passionate missionary-style fuck. He holds her leg up, his hand grasping her thigh, as they move in sync, lost in the intimacy of the moment."
"MilkyAmazon1-4","milky_amazon1_S4","{actor1} is kneeling over {actor0}, who's lying back, as they engage in a passionate vaginal sex act, with {actor0}'s stiff cock buried inside {actor1}'s wet pussy. {actor0} gently holds {actor1}'s leg, supporting her as she moves in rhythm with him."
"MilkyAlchemytable1-5","milky_alchemytable1_S5","{actor1} is bent over, while {actor0} is standing behind her, his hand is wrapped around his own throbbing cock as he masturbates, his eyes fixed on {actor1}'s voluptuous ass."
"MilkyBackrub1-1","milky_backrub1_S1","{actor0} is standing, bent over {actor1}, who is lying on her front, as he holds her body."
"MilkyAmazon1-2","milky_amazon1_S2","{actor1} is kneeling over {actor0}, who's lying back, as they engage in a passionate cowgirl-style vaginal sex, with {actor0}'s penis deeply penetrating {actor1}'s vulva. Meanwhile, {actor1} tenderly holds {actor0}'s chin with one hand and wraps her other arm around his body, holding him close in a romantic gesture."
"MilkyAlchemytable2-4","milky_alchemytable2_S4","{actor0} is sitting on top of {actor1}, who is lying back, as he thrusts his cock into her pussy in a missionary position, his hand wrapped around her leg, holding it in place."
"MilkyCowgirlFuni1-1","milky_cowgirl_funi1_S1","{actor0} lies back as {actor1} sits on top of him, her vulva grinding against his penis in a sexual motion, her hands holding onto his body for support. Meanwhile, {actor0} reaches up with one hand to hold {actor1}'s leg, his fingers wrapped firmly around her calf as they move together in a steamy, milky cowgirl position."
"MilkyCowgirl4-3","milky_cowgirl4_S3","{actor1} is sitting on top of {actor0}, who is lying back, as they engage in a passionate cowgirl-style vaginal sex, with {actor0}'s cock thrusting into {actor1}'s vulva. Meanwhile, {actor1} wraps her arms around {actor0}'s body, holding him close, while {actor0} grasps {actor1}'s body, pulling her deeper into their intense, milky union."
"MilkyCowgirl4-5","milky_cowgirl4_S5","{actor1} is riding {actor0} in a cowgirl position, her vulva enveloping his penis as they engage in passionate vaginal sex. Meanwhile, {actor1} gently holds {actor0}'s chin with her hand, a romantic gesture, while {actor0} wraps his arms around her body, pulling her close."
"MilkyCowgirl5-4","milky_cowgirl5_S4","{actor1} sits on top of {actor0}, who's lying back, as they engage in a passionate cowgirl-style vaginal sex, with {actor0}'s penis deep inside {actor1}'s vulva. {actor1} wraps her arms around {actor0}'s body, holding him close, while {actor0} tenderly holds {actor1}'s hip and gently grasps her leg, as they move in sync, surrounded by a milky ambiance."
"MilkyCowgirlmissonary1-4","milky_cowgirlmissonary1_S4","{actor0} is sitting between {actor1}'s legs, his cock buried deep inside her pussy as they fuck in a passionate missionary position. {actor1} lies back, her hands gently holding onto {actor0}'s leg as he thrusts into her."
"MilkyLotus1-3","milky_lotus1_S3","{actor0} is sitting, his cock buried deep inside {actor1}'s pussy as she sits on his lap, her walls snug around his shaft."
"MilkyDoggy1-1","milky_doggy1_S1","{actor0} is standing behind {actor1}, who's on all fours, as he holds her hip with one hand and rubs her clit with the other, their movements fluid and intimate."
"MilkyLaying1-5","milky_laying1_S5","{actor0} is kneeling beside {actor1}, who is lying on her front, as he grinds his penis against her vulva in a sensual, sexual motion. At the same time, {actor0} gently holds {actor1}'s hip with his hand, adding a touch of romance to the intimate moment."
"MilkyMissionary2-2","milky_missionary_2_S2","{actor0} is kneeling between {actor1}'s legs as she lies back, his penis thrusting into her vulva in a sensual missionary position. At the same time, he's gently holding her leg and clasping her hand in a romantic gesture, as she holds his hand in return."
"MilkyLotus2-5","milky_lotus2_S5","{actor0} and {actor1} sit facing each other, their faces inches apart. {actor0} thrusts his cock into {actor1}'s pussy as he holds onto her hip, his fingers digging gently into her skin, while {actor1} wraps her hand around {actor0}'s neck, pulling him closer as they engage in a passionate, milky vaginalsex."
"MilkyMissionary2-5","milky_missionary_2_S5","{actor0} is kneeling between {actor1}'s legs, his cock thrusting into her pussy as they engage in a passionate missionary-style fuck, while he holds her arm in his hand as she lies back."
"MilkyDoggy2-3","milky_doggy2_S3","{actor0} is kneeling, holding {actor1}'s leg and her body, as he thrusts his shaft into her vulva from behind in a doggy style position, with {actor1} suspended in mid-air."
"MilkyAlchemytable2-5","milky_alchemytable2_S5","{actor0} is sitting, his penis deeply penetrating {actor1}'s vulva in a sensual missionary position, as he holds her leg, while she lies back, taking in the pleasure."
"MilkyAlchemytable1-2","milky_alchemytable1_S2","{actor0} is standing behind {actor1}, who is bending over with her legs apart, as he thrusts his erect cock into her pussy from behind in a doggy-style position. At the same time, {actor0} reaches around to hold {actor1}'s arm, holding her in place as they engage in passionate vaginal sex."
"MilkyBackrub1-2","milky_backrub1_S2","{actor0} is standing, bent over, with his hand between {actor1}'s legs, fingering her vulva in a sexual motion, while his other hand is holding her hip in a romantic gesture, as she lies on her front."
"MilkyCunnilingus1-5","milky_cunnilingus1_S5","{actor0} lies back as {actor1} kneels over him, her hand wrapped around his dick, stroking him in a sensual handjob, while he buries his face between her thighs, performing a passionate cunnilingus on her vulva, his mouth devouring her in a frenzy of oral pleasure."
"MilkyDoggy1-2","milky_doggy1_S2","{actor0} is standing behind {actor1}, who is on all fours, as he holds her hip in a romantic grasp with one hand. At the same time, he is penetrating her vagina with his penis, engaged in a passionate act of vaginal sex."
"MilkyLotus2-3","milky_lotus2_S3","{actor0} sits with {actor1} on his lap, his cock buried deep in her pussy as they engage in passionate vaginal sex. Meanwhile, {actor1} wraps her arms around {actor0}'s body, holding him close, while {actor0} gently grasps her hip, his hand resting on her curves."
"MilkyLotus2-4","milky_lotus2_S4","{actor0} sits with {actor1} on his lap, his cock buried deep in her pussy as they engage in passionate vaginal sex. Meanwhile, {actor1} wraps her arms around {actor0}'s body, holding him close, while {actor0}'s hands grasp her hips, his fingers digging gently into her skin in a romantic gesture."
"MilkyDoggy2-1","milky_doggy2_S1","{actor0} is kneeling behind {actor1}, who is also on her knees, as he penetrates her from behind in a doggy-style position. At the same time, he reaches around to finger her vulva, stimulating her sexually, while holding onto her body with his other hand."
"MilkyDoggy2-5","milky_doggy2_S5","{actor0} is kneeling behind {actor1}, who's also on her knees, as he pounds into her from behind in a doggy-style position, his hands grasping her arms for leverage, his dick thrusting in and out of her pussy in a sexual rhythm."
"MilkyMissionary3-4","milky_missionary_3_S4","{actor0} is kneeling between {actor1}'s legs, his dick thrusting into her pussy as she lies back, her hands wrapped around his torso, holding him close."
"MilkyMissionarylegup1-1","milky_missionarylegup1_S1","{actor0} is kneeling beside {actor1}, who is lying on her side, as he strokes his cock in a sexual manner, bringing himself to the edge of orgasm, while gently holding {actor1}'s leg in his hand."
"MilkyDoggy3-5","milky_doggy3_S5","{actor0} is kneeling behind {actor1}, who is also on her knees, as he thrusts his dick into her pussy from behind in a doggy-style position, holding onto her arm for leverage."
"MilkyFmWallHub","\N","{actor0} and {actor1} stand facing each other, their bodies almost touching, with their feet firmly on the ground, eagerly anticipating their next erotic encounter."
"MilkyMissionarylegup1-3","milky_missionarylegup1_S3","{actor0} is kneeling between {actor1}'s legs, his dick buried deep inside her pussy as they engage in passionate missionary-style sex, his hand wrapped around her leg, holding it in place. {actor1} lies on her side, her body wrapped around his, lost in the moment."
"MilkyPage2","\N","{actor0} and {actor1} stand facing each other, both with their feet firmly on the ground, anticipation building as they await their next intimate encounter. The air is charged with expectation, their bodies tense with desire."
"MilkyMissionary3-3","milky_missionary_3_S3","{actor0} is kneeling between {actor1}'s spread legs as she lies back, his erect cock buried deep in her pussy as they engage in passionate vaginal sex. Meanwhile, {actor1} has her hand wrapped around {actor0}'s neck, holding him close as he thrusts into her."
"MilkyReversecowgirl1-2","milky_reversecowgirl1_S2","{actor0} is lying back while {actor1} sits on top of him, facing away, in a reverse cowgirl position. {actor1} has her vulva wrapped around {actor0}'s penis as they engage in a passionate, sexual vaginal intercourse, with {actor1} gently holding {actor0}'s leg."
"MilkyCowgirlmissonary1-5","milky_cowgirlmissonary1_S5","{actor0} lies back as {actor1} sits on top of him, her vulva enveloping his erect cock in a sensual missionary position. {actor1} simultaneously pleasures herself, rubbing her own clit as she holds {actor0}'s leg, intensifying the intimacy of their milky passionate encounter."
"MilkyCowgirlFuni1-3","milky_cowgirl_funi1_S3","{actor1} is sitting on top of {actor0} in a cowgirl position, her vulva enveloping his erect cock as they engage in passionate vaginal sex. Meanwhile, {actor0} is lying back, one hand romantically holding {actor1}'s hip and the other grasping her leg, as they move in sync."
"MilkyMissionary2-3","milky_missionary_2_S3","{actor0} is kneeling between {actor1}'s legs as she lies back, his cock sliding in and out of her pussy in a sensual rhythm. At the same time, he's got a firm grip on her body, holding her in place, while she reaches up to grasp his arm, her hand wrapping tightly around his bicep."
"MilkyMissionarylegup1-5","milky_missionarylegup1_S5","{actor0} is kneeling beside {actor1}, who is lying on her side, as he leans in to lick her nipple, his tongue dancing across her breast in a sensual, oral caress. At the same time, they're holding hands, their fingers intertwined in a romantic gesture, adding an intimate touch to the moment."
"MilkyStanding1-1","milky_standing1_S1","{actor0} stands tall, his erect cock being jerked off by {actor1}'s skilled hand in a sensual handjob, while she simultaneously wraps her arms around his body, holding him close. Meanwhile, {actor0} reciprocates the intimacy, his arms embracing {actor1}'s body, pulling her nearer as they share a passionate moment."
"MilkyAmazon1-5","milky_amazon1_S5","{actor1} is kneeling beside {actor0}, who is lying back, as she gives him a handjob, her hand gripping his shaft. At the same time, she's holding onto his body, her hand wrapped around his torso."
"MilkyBed1-1","milky_bed1_S1","{actor0} kneels before {actor1}, who sits with her legs spread, as he reaches up to tenderly rub her clitoris, his fingers dancing across her vulva. At the same time, he wraps his arm around her body, pulling her close to him."
"MilkyBackrub1-5","milky_backrub1_S5","{actor0} is standing over {actor1}, who's lying on her front, as he strokes his throbbing cock, his eyes fixed on her. At the same time, he's got a firm grip on her body, holding her in place."
"MilkyBench2-4","milky_bench2_S4","{actor0} is standing over {actor1}, bending over her as she lies back, his penis thrusting into her vulva in a passionate vaginal sex act, while his hand is wrapped around her neck, holding it firmly."
"MilkyBed3-3","milky_bed3_S3","{actor1} is kneeling over {actor0}, who's lying back, as they engage in a passionate cowgirl-style vaginal sex session. {actor0} wraps his hands around {actor1}'s body, holding her close, while {actor1} grasps {actor0}'s body firmly with her hands, both of them lost in the intensity of the moment."
"MilkyBed3-4","milky_bed3_S4","{actor1} is riding {actor0} in a cowgirl position, her vulva enveloping his shaft as they engage in passionate vaginal sex. Meanwhile, {actor0} is lying back, holding onto {actor1}'s leg, while {actor1} has her hands on {actor0}'s body, their bodies moving in sync as they savor the intimate moment."
"MilkyCowgirl2-1","milky_cowgirl2_S1","{actor0} lies back, stroking his cock in a sensual motion, while {actor1} sits on top of him, her hips grinding against his groin as she fingers her slippery pussy, both lost in their own self-pleasure."
"MilkyBench2-5","milky_bench2_S5","{actor0} is standing and bent over, his cock buried deep in {actor1}'s pussy as she lies on her back. At the same time, {actor0} has his hand wrapped around {actor1}'s neck, holding her in place."
"MilkyCowgirl1-3","milky_cowgirl1_S3","{actor1} sits on top of {actor0}, who's lying back, as they engage in a passionate cowgirl-style vaginal sex session. {actor0} grips {actor1}'s leg while {actor1} holds onto {actor0}'s leg, their bodies moving in sync as they savor the intimate moment."
"MilkyCowgirl2-4","milky_cowgirl2_S4","{actor1} is sitting on top of {actor0}, who's lying back, in a cowgirl position, as they engage in passionate vaginal sex. Meanwhile, {actor0} has his hand wrapped around {actor1}'s leg, while {actor1} has her hand grasping {actor0}'s leg, adding to the intense intimacy of the moment."
"MilkyCowgirl3-1","milky_cowgirl3_S1","{actor1} sits on top of {actor0}, who's lying back, as she grinds her vulva onto his erect penis in a sensual cowgirl position, milky white fluids mingling in the intimate moment."
"MilkyCowgirl3-4","milky_cowgirl3_S4","{actor0} lies back as {actor1} straddles him, her vulva enveloping his stiff cock in a sensual, milky cowgirl position, their bodies moving in sync as they engage in passionate vaginal sex."
"MilkyCowgirl5-3","milky_cowgirl5_S3","{actor0} lies back as {actor1} sits on top of him, riding his cock in a steamy cowgirl position, her milky skin glistening with passion. {actor1} holds {actor0}'s body close, her hands on his chest, while he wraps one hand around her hip and the other gently grasps her leg, lost in the thrill of their intense vaginal sex."
"MilkyCowgirl5-5","milky_cowgirl5_S5","{actor0} lies back as {actor1} sits on top of him, her vulva engulfing his cock in a passionate, sexual rhythm, their bodies milking each other for pleasure in a cowgirl position. {actor0}'s hands are clasped around {actor1}'s hip, holding her close in a romantic gesture, while his other hand grasps her leg, supporting her as she rides him, and {actor1}'s hands are wrapped around his body, holding him tight."
"MilkyLotus1-4","milky_lotus1_S4","{actor0} is sitting with his cock buried deep in {actor1}'s pussy as they engage in passionate vaginal sex, his hand grasping her leg as they sit together."
"MilkyCowgirl3-3","milky_cowgirl3_S3","{actor0} is lying back while {actor1} straddles him in a cowgirl position, her milky skin glistening as she rides his throbbing cock, their bodies moving in sync as they engage in passionate vaginal sex."
"MilkyLotus1-1","milky_lotus1_S1","{actor0} sits with his penis deep inside {actor1}'s vulva as they engage in a passionate vaginalsex, while {actor1} wraps her arms around {actor0}'s body, holding him close."
"MilkyCowgirl3-2","milky_cowgirl3_S2","{actor1} is riding {actor0} in a cowgirl position, her milky skin glistening as she sits on top of him, his penis deep inside her vulva. She holds {actor0}'s leg as she moves, her breasts bouncing with each motion."
"MilkyCunnilingus1-3","milky_cunnilingus1_S3","{actor0} lies back as {actor1} kneels over him, her hand wrapped around his throbbing cock, stroking him off in a sensual handjob. At the same time, {actor0} buries his face between {actor1}'s thighs, his mouth devouring her vulva in a hungry cunnilingus."
"MilkyMissionary1-4","milky_missionary_1_S4","{actor0} is kneeling between {actor1}'s legs as she lies back, his throbbing cock buried deep inside her wet cunt as they engage in passionate, sexual vaginal sex. At the same time, he's gently holding her hip with one hand, a romantic gesture that adds an intimate touch to their fervent lovemaking."
"MilkyMissionary2-1","milky_missionary_2_S1","{actor0} is kneeling between {actor1}'s legs, his penis nestled between her thighs as she lies back, her legs wrapped around him in a milky missionary position. At the same time, {actor0} is holding {actor1}'s leg, his hand grasping her ankle as he thrusts into the warm haven of her thighs."
"MilkyDoggy3-1","milky_doggy3_S1","{actor0} is kneeling behind {actor1}, who's on all fours, as he romantically holds her hip. At the same time, he's stroking his shaft, pleasuring himself in a sexual solo act."
"MilkyCowgirl4-4","milky_cowgirl4_S4","{actor0} is lying back while {actor1} sits on top of him, riding his cock in a cowgirl position as they engage in intimate, vaginal sex. Meanwhile, {actor1} gently holds {actor0}'s chin, adding a romantic touch to the scene, as {actor0} wraps his hands around {actor1}'s body, drawing her closer."
"MilkyMissionarylegup1-4","milky_missionarylegup1_S4","{actor0} is kneeling beside {actor1}, who is lying on her side, as he thrusts his penis into her vulva in a sensual missionary-style vaginal sex act, his hand wrapped around her leg."
"MilkyLaying1-2","milky_laying1_S2","{actor0} is kneeling beside {actor1}, who is lying on her side, as he thrusts his cock into her pussy in a passionate, sexual vaginalsex act. At the same time, {actor1} gently holds {actor0}'s chin with her hand, a romantic gesture that adds an intimate touch to their encounter."
"MilkyPage1","\N","{actor0} and {actor1} stand facing each other, both with their feet planted firmly on the ground, anticipation hanging in the air as they prepare for their next intimate encounter. The tension between them is palpable as they await the moment to transition from idle anticipation to passionate engagement."
"MilkyAlchemytable2-1","milky_alchemytable2_S1","{actor0} is standing, his thighs wrapped around {actor1}'s rigid shaft as she works him up and down, her body pressed against his in a sensual thighjob. At the same time, {actor0} wraps his hands around {actor1}'s hips, holding her close in a romantic clasp, his fingers digging gently into her curves."
"MilkyAlchemytable1-3","milky_alchemytable1_S3","{actor0} is standing behind {actor1}, who is bent over with her legs spread wide, as he pounds into her pussy from behind in a doggy style position, holding onto her leg for leverage."
"MilkyBed1-4","milky_bed1_S4","{actor0} stands over {actor1}, who lies back, as they engage in missionary-style vaginal sex, his penis deep inside her vulva."
"MilkyBed1-2","milky_bed1_S2","{actor0} is kneeling and bent over {actor1}, who's lying on her back, as he/Happlication his fingers to her vulva, tantalizingly rubbing her clitoris. At the same time, he's got a firm grip on her body, holding her in place."
"MilkyBackrub1-4","milky_backrub1_S4","{actor0} is standing with his body bent over, slamming his cock into {actor1} from behind in a doggy-style position as she lies on her front. At the same time, he's got a firm grip on her body with one hand and a tight grasp on her neck with the other, holding her in place."
"MilkyBed2-3","milky_bed2_S3","{actor0} is kneeling behind {actor1}, who is on all fours, as he thrusts his cock into her pussy in a passionate doggy style position, his hands grasping her hips."
"MilkyBed2-2","milky_bed2_S2","{actor0} is kneeling behind {actor1}, who's on all fours, as he plunges his stiff cock into her slit from behind in a passionate doggy-style vaginal romp, his hands grasping her hips."
"MilkyBed3-1","milky_bed3_S1","{actor0} is lying back, while {actor1} is lying beside him, her hand wrapped around his cock as she strokes it in a sensual handjob. At the same time, {actor0} has his arm around {actor1}, holding her close to his body."
"MilkyBench2-3","milky_bench2_S3","{actor0} is standing over {actor1}, bent over her as she lies back, his dick thrusting into her pussy in a passionate vaginal sex act. Meanwhile, he has his hand wrapped tightly around her neck, holding it firmly in place."
