"ostim_id","sexlab_id","description"
"NibblesSidewaysfuck-3","NibblesSidewaysFuck_S3","{actor0} is lying on his side, feet on the ground, with {actor1} lying beside him, her legs spread wide as she faces away. He's thrusting his cock into her pussy, his hand grasping her leg as they engage in passionate vaginal sex."
"NibblesSidewaysfuck-4","NibblesSidewaysFuck_S4","{actor0} lies on his side, his feet planted firmly on the ground, as he engages in passionate vaginal sex with {actor1}, who lies on her side with her legs spread wide and her back turned to him. As they move in unison, {actor0} reaches out to gently hold {actor1}'s leg, his hand wrapping around her thigh as they savor the intimate connection."
"NibblesStandingfuck4-1","Nibblesstandingfuck4_S1","{actor0} stands facing {actor1}, who has her back to him, and wraps his arms around her hips, holding her in place as he grinds his erection between her thighs, his hips thrusting gently in a sensual rhythm."
"NibblesStandingfuck4-2","Nibblesstandingfuck4_S2","{actor0} stands behind {actor1}, who is bent over with her feet on the ground, as he nibbles on her skin while holding her body with one hand and sliding his cock into her pussy from behind."
"NibblesStandingfuck4-3","Nibblesstandingfuck4_S3","{actor0} stands behind {actor1}, who is bent over, as he nibbles on her neck. He thrusts his cock into her pussy, holding onto her body with one hand, while she wraps her arms around him, pulling him close in a sensual hug."
"NibblesStandingfuck4-4","Nibblesstandingfuck4_S4","{actor0} stands with his feet on the ground, his penis thrusting into {actor1}'s vulva as they engage in vaginal sex. Meanwhile, {actor0} holds {actor1}'s leg, and {actor1} wraps her arms around {actor0} in a sensual one-sided hug, her legs spread wide as she nibbles on him."
"NibblesStandingfuck4-5","Nibblesstandingfuck4_S5","{actor0} stands with his feet shoulder-width apart, his erection buried deep within {actor1}'s pussy as she stands facing away from him, her legs spread wide, climaxing in sync with him. He has one hand grasping her thigh, holding her leg in place, while {actor1} wraps her arms around him, pulling him close in a sensual one-sided hug, both of them reaching a frenzied peak together."
"NibblesThreesome2-1","Nibblesthreesome2_S1","{actor0} is kneeling beside {actor1}, who is lying back, while {actor2} is lying on top of {actor1}, her front facing his. {actor0} is sensually groping {actor2}'s butt with one hand and using his other hand to sexually finger her vulva, as {actor2} simultaneously gives {actor1} a handjob, stroking his cock."
"NibblesThreesome2-2","Nibblesthreesome2_S2","{actor0} is kneeling, thrusting his dick into {actor2} from behind as she's on all fours, her hips being held by his hands. At the same time, {actor2} is giving {actor1} a blowjob, her mouth wrapped around his cock, as he lies back with his feet on the ground."
"NibblesThreesome2-3","Nibblesthreesome2_S3","{actor0} is kneeling, thrusting his dick into {actor2} from behind as she's on all fours, her hips held firmly by his hands. Meanwhile, {actor2} is simultaneously blowing {actor1}, who's lying back with his feet on the ground, his head held gently by {actor1}'s hands as he's actively receiving the blowjob."
"NibblesThreesome2-4","Nibblesthreesome2_S4","{actor0} is kneeling, thrusting his cock into {actor2} from behind as she's on all fours, her hips being held by his hands. At the same time, {actor2} is giving {actor1}, who is also kneeling, a blowjob, her mouth wrapped around his erect penis as {actor1} holds her head, his fingers tangled in her hair."
"NibblesThreesome2-5","Nibblesthreesome2_S5","{actor0} is on his knees, thrusting into {actor2} from behind as she's on all fours, his hands grasping her hips, while {actor1} kneels beside them, his head being held by {actor2} as she expertly sucks his cock, both men climaxing in unison."
"NibblesThreesomestanding-1","Nibblesthreesomestanding_S1","{actor0} stands idly by as {actor1} stands behind {actor2}, who is bent over, and slips his fingers into her pussy, fingering her vagina."
"NibblesThreesomestanding-2","Nibblesthreesomestanding_S2","{actor0} stands behind {actor2}, his penis thrusting into her vulva as he holds her leg. Meanwhile, {actor1} stands beside them, his penis penetrating {actor2}'s butt from behind, his hand grasping her body. As they engage in a double penetration, {actor2} wraps her arms around {actor0}, pulling him into a sensual hug, her lips nibbling on his skin."
"NibblesThreesomestanding-4","Nibblesthreesomestanding_S4","{actor0} and {actor1} are simultaneously penetrating {actor2}, who is suspended in mid-air, with {actor0} thrusting his cock into her pussy and {actor1} driving his dick into her ass. {actor0} is standing with his feet on the ground, holding one of {actor2}'s legs, while {actor1} is also standing, holding onto {actor2}'s body as they both ravage her."
"NibblesThreesomestanding-5","Nibblesthreesomestanding_S5","{actor0} and {actor1} stand with their feet on the ground, both reaching a thrilling orgasm as they simultaneously pleasure {actor2}, who is suspended in mid-air. {actor0}'s erection is thrust into {actor2}'s vulva, while {actor1}'s penis penetrates her butt, a double penetration that sends her into a frenzied climax. Meanwhile, {actor0} holds {actor2}'s leg, stabilizing her as she's sandwiched between the two men, while {actor1} wraps his arms around her, pulling her close in a sensual one-sided hug."
"Nibbles69consensual-1","Nibbles69Consensual_S1","{actor0} is lying back while {actor1} is lying on top of him, front to front, as she wraps her hand around his shaft and gives him a sensual handjob, stroking his cock in a smooth, deliberate motion."
"Nibbles69consensual-4","Nibbles69Consensual_S4","{actor0} lies on his back, with {actor1} on top of him, her feet planted firmly on the ground. She faces away from him, her mouth wrapped around his throbbing cock as she gives him a blowjob, while he simultaneously buries his face in her vulva, his tongue darting in and out as he licks her clit in a passionate 69 position."
"NibblesBellyflop-1","Nibblesbellyflop_S1","{actor0} is kneeling beside {actor1}, who's lying on her front, facing away from him. He's masturbating himself while simultaneously groping her butt with his free hand, his fingers caressing her skin in a sensual manner."
"NibblesBellyflop2-2","Nibblesbellyflop2_S2","{actor0} is kneeling behind {actor1}, who's lying on her front, facing away from him. He's thrusting his cock into her pussy while holding onto her hip, as he nibbles on her skin, creating a romantic and intimate atmosphere."
"NibblesBellyflop2-6","Nibblesbellyflop2_S6","{actor0} is lying on top of {actor1}, his body pressed against hers as they face away from each other, their hips locked in a passionate rhythm as he thrusts into her vulva, his penis sliding in and out of her in a sensual motion, both of them climaxing in unison. Meanwhile, {actor0} wraps his arms around {actor1} in a tight, sensual hug, pulling her close as they transition into a moment of tender intimacy."
"NibblesCowgirl5-4","NibblesCowgirl5_S4","{actor1} is sitting on top of {actor0}, who's lying back on the bottom, as she rides him in a passionate cowgirl position, her vulva enveloping his erect penis in a sensual, sexual union, with her gentle nibbles on his skin adding to the erotic intensity."
"NibblesCowgirl5-5","NibblesCowgirl5_S5","{actor1} is riding {actor0} in a fierce cowgirl position, her vulva sliding up and down on his erect cock as they share a passionate, sensual kiss, their tongues intertwining as they both reach a screaming orgasm, their bodies shuddering in unison as they climax. Meanwhile, {actor0} lies back, his eyes closed in ecstasy, his hands gripping {actor1}'s hips as she nibbles on his lip, their love-making reaching a fever pitch."
"NibblesCowgirl6-5","NibblesCowgirl6_S5","{actor1} straddles {actor0}, who's lying on his back, as they vigorously ride each other in a steamy cowgirl position, both of them climaxing in unison. At the same time, {actor0} wraps his arms around {actor1} in a sensual hug, while they share a romantic and sensual kiss. Additionally, {actor0} reaches around to grope {actor1}'s butt, heightening their passionate connection as they reach orgasm."
"NibblesCowgirlfemdom-1","NibblesCowgirlFemdom_S1","{actor1} sits on top of {actor0}, who lies back on the bottom, as she dominates him in a fierce cowgirl position. With one hand, she holds his arm, and with the other, she grasps his head, while simultaneously nibbling on his ear, as she actively rides his shaft, her vulva enveloping his penis in a passionate, sexual union."
"NibblesDoggystyle4-2","Nibblesdoggystyle4_S2","{actor0} is kneeling behind {actor1}, who's on all fours facing away from him, as he pounds into her vulva in a doggystyle position, his hands grasping her hips. At the same time, his mouth nibbles on her skin, adding a tender touch to their intense, sexual vaginal intercourse."
"NibblesLapfuck-1","NibblesLapFuck_S1","{actor0} is sitting on the bottom, while {actor1} is kneeling on top of him, riding him in a cowgirl position. As they engage in passionate vaginal sex, {actor1} is actively taking control, and {actor0} is holding onto her hip, adding a romantic touch to their intense encounter."
"NibblesLapfuck-2","NibblesLapFuck_S2","Here's the description of the scene:

{actor1} is kneeling on top of {actor0}, riding him in a provocative cowgirl position, her vulva grinding against his erect penis as she takes control of the vigorous vaginal sex. Meanwhile, {actor0} is sitting comfortably on the bottom, his hands gripped around {actor1}'s hips, holding on tight, and {actor1} has her arms wrapped sensually around {actor0}'s torso, pulling him into a one-sided hug."
"NibblesLapfuck2-2","NibblesLapFuck2_S2","{actor0} sits on the bottom, with {actor1} straddling him in a cowgirl position, her feet planted firmly on the ground. As they engage in passionate vaginal sex, {actor1} takes the lead, moving rhythmically on top of {actor0}, who grasps her hips, his hands holding tight as they both savor the intimate connection."
"NibblesLapfuck2-4","NibblesLapFuck2_S4","{actor0} is sitting on the bottom, while {actor1} straddles him, her feet planted firmly on the ground. As she assumes the cowgirl position, she gently nibbles on his neck, sending shivers down his spine. Meanwhile, {actor0} grasps {actor1}'s hip with one hand, holding her close, while {actor1} actively rides him, her vulva enveloping his penis in a sensual vaginalsex motion. {actor0} wraps his arms around {actor1}, pulling her into a one-sided hug, drawing her closer to his chest."
"NibblesMissionary2-3","Nibblesmissionary2_S3","{actor0} mounts {actor1} in a classic missionary position,  but flips it around, with {actor1} actually on top and {actor0} on all fours, as {actor1} wraps her arms around him, pulling him into a sensual hug. At the same time, they engage in passionate, sexual vaginal intercourse, with {actor0}'s penis inside {actor1}'s vulva."
"NibblesMissionary2-5","Nibblesmissionary2_S5","{actor0} is on top of {actor1}, in a missionary position, with his erect cock thrusting into her moist vulva as they engage in passionate, sensual vaginalsex. Meanwhile, they're nibbling on each other's lips, locked in a romantic and sensual kiss, while {actor1}'s hand wraps around {actor0}'s, their fingers intertwined in a tender gesture, as {actor0} reaches climax, his body shuddering in ecstasy."
"NibblesScrew-5","NibblesScrew_S5","{actor0} kneels between {actor1}'s legs as she lies back, his erect cock sliding into her pussy in a slow, sensual missionary position. At the same time, he grasps her hip with one hand, holding her close, while she wraps her arms around him, pulling him into a tight, one-sided hug, nibbling on his shoulder."
"NibblesScrew-6","NibblesScrew_S6","{actor0} is lying on top of {actor1} in a missionary position, with his shaft thrusting into her wet snatch as they share a passionate, sensual kiss. They're both climaxing, their bodies entwined as they hold each other in a tight, sensual hug, with {actor1}'s arms wrapped around {actor0}'s torso and his arms around her, pulling her close."
"NibblesSidewaysfuck-5","NibblesSidewaysFuck_S5","{actor0}, his feet planted firmly on the ground, lies on his side, his body tense in the throes of orgasm, as he thrusts his cock into {actor1}, who is also lying on her side, her legs spread wide. At the same time, he wraps his arms around her, holding her close in a sensual one-sided hug. Meanwhile, {actor1} is also rubbing her own clitoris with her hand, adding to her own building ecstasy."
"NibblesThreesomestanding-3","Nibblesthreesomestanding_S3","{actor2} is suspended in mid-air, her legs spread wide as {actor0} stands before her, his feet planted firmly on the ground, his cock buried deep in her pussy. At the same time, {actor1} stands behind her, his hands grasping her body, his penis thrusting into her ass, while {actor0} holds onto her leg for leverage. As they both pound into her, {actor2} wraps her arms around {actor0}, pulling him into a tight hug, her nipples pressed against his chest. The air is thick with the sound of their labored breathing and the smell of sex, as the trio hurtles towards a frenzied climax."
"NibblesAfDrunkmasturbation-6","NibblesDrunkMasturbation_S6","{actor0} is lying on her side, her hands between her legs as she indulges in some solo pleasure. She's fingering her own pussy, rubbing her clitoris in a sensual motion, lost in her own orgasmic high, her body trembling with each wave of ecstasy as she reaches her peak."
"NibblesAfSpankingchair-1","NibblesSpankingChair_S1","{actor0} is sitting in the chair with his feet planted firmly on the ground, while {actor1} is lying on her front, her body stretched out before him, her skin vulnerable to his touch. The air is charged with anticipation, as if waiting for the moment when he'll reach out and spank her, or lean in to nibble on her skin."
"NibblesAfTablestandingfront-1","NibblesTableStandingFront_S1","{actor0} stands next to the table with his feet on the ground, his dick buried deep inside {actor1}'s pussy as she sits on the edge, her legs wrapped around his waist. At the same time, he wraps his arms around her, holding her close in a sensual one-sided hug, as they share a romantic and sensual kiss, his lips pressed against hers, their tongues intertwined, while he gently nibbles on her lip."
