"ostim_id","sexlab_id","description"
"NibblesAfSpanking-2","NibblesSpanking_S2","{actor0}, a male, sits on the chair with his feet planted firmly on the ground, while {actor1}, a female, lies front-first across his lap, her body positioned for a spanking, as he gently nibbles on her skin."
"NibblesAfSpanking-3","NibblesSpanking_S3","{actor0} is sitting in the chair with his feet firmly on the ground, while {actor1} is lying front-down across his lap, her feet also touching the floor."
"NibblesAfSpanking-4","NibblesSpanking_S4","{actor0} sits in the chair, feet planted firmly on the ground, while {actor1} lies on her front across his lap, her feet also on the ground."
"NibblesAfSpanking-5","NibblesSpanking_S5","{actor0} sits in the chair with his feet planted firmly on the ground, while {actor1} lies front-first across his lap, her feet also touching the floor, receiving a gentle spank on her backside as {actor0} nibbles on her neck."
"NibblesAfSpankingchair-2","NibblesSpankingChair_S2","{actor0} is sitting in the chair, while {actor1} is lying front down across his lap, her feet dangling in the air, as he nibbles on her skin, his hand raised to spank her at any moment."
"NibblesAfSpankingchair-3","NibblesSpankingChair_S3","{actor0} is sitting in the chair with his feet on the ground, while {actor1} is lying front-first across his lap, her body positioned in a way that suggests a recent or impending spank, with {actor0}'s face close to hers as if he's about to nibble on her skin."
"NibblesAfSpankingchair-4","NibblesSpankingChair_S4","{actor1} is standing in front of {actor0}, who's sitting in the chair with his feet on the ground, as she playfully nibbles on his ear, teasing him."
"NibblesAfTablefuck-1","NibblesTableFuck_S1","{actor0} stands beside the bed, his feet planted firmly on the ground, as he leans over to passionately kiss {actor1}, who lies back on the bed, her body relaxed and receptive. At the same time, he gently holds her hand, feeling a romantic connection, while his other hand cradles her head, supporting it as they share a sensual and romantic kiss."
"NibblesAfTablefuck-2","NibblesTableFuck_S2","{actor0} stands beside the bed, his feet planted firmly on the ground, as he grinds his penis against {actor1}'s vulva, his body positioned to maximize the sensual contact. Meanwhile, {actor1} lies back on the bed, her legs slightly parted, allowing {actor0} to hold onto her leg as he moves against her."
"NibblesAfTablefuck-4","NibblesTableFuck_S4","{actor0} stands beside the bed, his feet planted firmly on the ground, as he engages in vaginal sex with {actor1}, who lies back on the bed, her vulva wrapped around his penis. Meanwhile, {actor0} wraps his arms around {actor1} in a sensual hug, and she reciprocates, embracing him tightly, their bodies entwined in a passionate lovers' hold."
"NibblesAfTablefuck-5","NibblesTableFuck_S5","{actor0} stands beside the bed, feet planted firmly on the ground, as he reaches his orgasmic peak. Meanwhile, {actor1} lies back on the bed, also climaxing, with {actor0}'s penis buried deep within her vulva as they engage in passionate vaginal sex. At the same time, {actor1} wraps her arms around {actor0}, holding him close in a sensual, one-sided hug."
"NibblesAfTablestandingbehind-1","NibblesTableStandingBehind_S1","{actor0} kneels beneath {actor1}, who stands with her feet on the ground, bent over and facing away from him, as he buries his face in her vulva, his tongue licking her swollen lips, while his hands grasp her hips, holding her in place."
"NibblesAfTablestandingbehind-2","NibblesTableStandingBehind_S2","{actor0} is standing behind {actor1}, who is bent over and facing away from him, with her feet on the ground. He's grinding his cock against her pussy, his hands holding onto her hips as they nibble on something at the table."
"NibblesAfTablestandingbehind-3","NibblesTableStandingBehind_S3","{actor0} is standing behind {actor1}, who is bent over with her feet on the ground, her back to him, as he nibbles on her. He's holding her hip with one hand while thrusting his cock into her pussy from behind."
"NibblesAfTablestandingbehind-5","NibblesTableStandingBehind_S5","{actor0} is standing with his feet on the ground, climaxing as he penetrates {actor1}'s pussy from behind, holding onto her hip with one hand as she bends over, her feet also on the ground, and she's climaxing too, her back to him, at the table."
"NibblesAfTablestandingfront-2","NibblesTableStandingFront_S2","{actor0} is standing with his feet on the ground, his penis buried deep in {actor1}'s vulva as they engage in passionate vaginal sex on the table. At the same time, he's gently holding {actor1}'s hip, who lies back, receiving him, as they savor the intimate moment."
"NibblesBellyflop-2","Nibblesbellyflop_S2","{actor0} is kneeling between {actor1}'s legs as she lies on her front, facing away from him, and he's thrusting his dick into her pussy in a passionate vaginal sex act."
"NibblesBellyflop-3","Nibblesbellyflop_S3","{actor0} is kneeling, thrusting his cock into {actor1}'s pussy as she lies on her front, facing away from him, her body arched in pleasure."
"NibblesBellyflop2-1","Nibblesbellyflop2_S1","{actor0} is kneeling beside {actor1}, who is lying on her front, facing away from him. He's thrusting his cock into her pussy while simultaneously groping her butt with his hands."
"NibblesAfTablefuck-3","NibblesTableFuck_S3","{actor0} stands beside the bed, his feet planted firmly on the ground, as he engages in vaginal sex with {actor1}, who lies back on the bed, her body receptive to his advances. Meanwhile, {actor1} wraps her arms around {actor0}, pulling him into a sensual one-sided hug, as he nibbles on her skin, their bodies entwined in a passionate embrace."
"NibblesAfTablestandingbehind-4","NibblesTableStandingBehind_S4","{actor0} is standing at the table, his feet planted firmly on the ground, as he rails {actor1} from behind, his dick sliding in and out of her pussy. Meanwhile, he's got a tight grip on her hip, holding her in place as she bends over, her feet still on the ground, her back to him, her body arched in pleasure."
"NibblesAfTablestandingfront-3","NibblesTableStandingFront_S3","{actor0} is standing beside the table with his feet on the ground, his penis inside {actor1}'s vulva as they engage in vaginal sex. At the same time, he's holding {actor1}'s hip, his hand grasping her gently as she lies back on the table."
"NibblesAfTablestandingfront-4","NibblesTableStandingFront_S4","{actor0} stands beside the table, his feet planted firmly on the ground, as he engages in vaginal sex with {actor1}, who lies back on the table, his penis thrusting into her vulva. Meanwhile, {actor0} wraps his arms around {actor1} in a sensual one-sided hug."
"NibblesAfTablestandingfront-5","NibblesTableStandingFront_S5","{actor0} stands at the table, his feet planted firmly on the ground, as he reaches orgasm, his body trembling with release. Meanwhile, {actor1} lies back on the table, her body also racked with pleasure as she climaxes. {actor0}'s penis is deep inside {actor1}'s vulva as they engage in passionate vaginal sex. At the same time, {actor0}'s hands are all over {actor1}'s breasts, groping and caressing them sensually. As they're lost in the moment, {actor0} wraps his arms around {actor1} in a tight hug, pulling her close, and {actor1} reciprocates, embracing {actor0} just as fiercely."
"NibblesAfTentacledoggy-1","NibblesTentacleDoggy_S1","{actor0}, a female, is on all fours, grinding against an object, her movements sensual and deliberate as she seeks sexual pleasure."
"NibblesAfTentacledoggy-2","NibblesTentacleDoggy_S2","{actor0}, a female, is on all fours, her knees digging into the surface as she receives mild vaginal sex, with her partner thrusting into her from behind."
"NibblesAfTentacledoggy-3","NibblesTentacleDoggy_S3","{actor0} is on all fours as she receives mild vaginal penetration, her partner's erection sliding in and out of her wet pussy."
"NibblesAfTentacledoggy-4","NibblesTentacleDoggy_S4","{actor0} lies on her front, her body relaxed as she receives mild vaginal penetration, her partner's shaft sliding smoothly in and out of her pussy."
"NibblesAfTentacledoggy-5","NibblesTentacleDoggy_S5","{actor0} is on all fours, her body in the midst of a fierce climax as she receives mild vaginal penetration."
"NibblesAfWorkbench-1","NibblesWorkbench_S1","{actor0} stands with his feet shoulder-width apart, stroking his stiff cock as he watches {actor1}, who is bent over the table, her feet still on the ground, facing away from him, her fingers busy massaging her wet pussy."
"NibblesAfWorkbench-2","NibblesWorkbench_S2","{actor0} is standing with his feet on the ground, masturbating with his own hand, while {actor1} stands facing away from him, bent over the table, teasing him."
"NibblesAfWorkbench-3","NibblesWorkbench_S3","{actor0} stands behind {actor1}, who is bent over the table, her feet on the ground, facing away from him, as he engages in vaginal sex with her, his penis thrusting into her vulva. Meanwhile, he nibbles on her neck, the scene transitioning into a more intimate moment."
"NibblesAfWorkbench-4","NibblesWorkbench_S4","{actor0} is standing behind {actor1}, who is bent over the table with her feet on the ground, her back facing him. He's nibbling on her neck as he holds onto her hip with one hand, while simultaneously thrusting his cock into her pussy from behind."
"NibblesAfWorkbench-5","NibblesWorkbench_S5","{actor0} is standing with his feet on the ground, holding {actor1}'s leg, as he pounds into her pussy from a standing position, her legs spread wide apart, while she stands with her feet on the ground, her table-supported body slightly arched back. Meanwhile, they share a passionate, intimate moment, lost in the heat of the vaginalsex."
"NibblesAfWorkbench-6","NibblesWorkbench_S6","{actor0} stands with his feet on the ground, his legs spread apart as he thrusts into {actor1}'s vulva, his penis deep inside her as they both reach a thunderous orgasm. At the same time, {actor0} vigorously holds {actor1}'s leg, her feet still on the ground, as she stands with her legs spread wide, her face contorted in ecstasy."
"NibblesAnalfingering-1","Nibblesanalfingering_S1","{actor0} is sitting on the bottom, while {actor1} is lying on top of him, facing away, her body positioned front-first. She's currently motionless, with her butt in the air, as {actor0} brings his hand down to spank her, his fingers nibbling at her skin before making contact."
"NibblesAnalfingering-3","Nibblesanalfingering_S3","{actor0} sits on the bottom, with {actor1} lying on top of him, facing away. As she leans back, {actor0} gently nibbles on her skin, while simultaneously using his hand to sexually stimulate her anus with his fingers, all the while holding hands with her in a romantic gesture."
"NibblesAnalfingering-4","Nibblesanalfingering_S4","{actor0} sits on the bottom, while {actor1} lies on top of him, facing away, her butt exposed. {actor0} reaches around to nibble her shoulder, as he simultaneously slips his finger into her asshole, teasing her with a sensual anal fingering."
"NibblesAnalfingering-5","Nibblesanalfingering_S5","{actor0} is sitting on the bottom, while {actor1} is lying on top of him, facing away. As she rides him, {actor0} is anally fingering {actor1}, bringing her to a intense orgasm, her body shuddering in ecstasy as she reaches a screaming climax."
"NibblesAnalfingering-2","Nibblesanalfingering_S2","{actor0} sits on the bottom, with {actor1} lying on top of him, facing away, her butt in the air. As they cuddle, {actor0} sensually gropes {actor1}'s butt with one hand, while holding her hand with the other, a romantic gesture."
"NibblesBellyflop-4","Nibblesbellyflop_S4","{actor0} is kneeling, his cock buried deep inside {actor1}'s pussy as she lies on her front, facing away from him, both of them reaching a frenzied orgasm."
"NibblesBellyflop2-3","Nibblesbellyflop2_S3","{actor0} is on all fours, while {actor1} lies on her front, facing away from him. As they engage in a passionate vaginal sex act, {actor0} thrusts his cock into {actor1}'s wet pussy, the two of them moving in sync as they build towards a fevered crescendo."
"NibblesBellyflop2-4","Nibblesbellyflop2_S4","{actor0} is on all fours, thrusting his dick into {actor1} from behind as she lies on her front, facing away from him, their bodies entwined in a passionate, primal union."
"NibblesBellyflop2-5","Nibblesbellyflop2_S5","{actor0} is lying on top of {actor1}, with his body pressed against hers as they face away from each other, his penis sliding in and out of her vulva in a sensual rhythm. At the same time, he wraps his arms around her, holding her close in a tender, one-sided hug, as {actor1} lies prone beneath him, her body receptive to his gentle nibbles."
"NibblesBlowjob2-1","Nibblesblowjob2_S1","{actor0} stands with his feet shoulder-width apart, his erect cock thrust into the eager mouth of {actor1}, who kneels before him, her lips wrapped around his shaft as she performs a passionate blowjob, her tongue dancing across his sensitive skin."
"NibblesBlowjob2-2","Nibblesblowjob2_S2","{actor0} stands tall, his feet firmly on the ground, as {actor1} kneels before him, her mouth wrapped around his throbbing cock, performing a deepthroat blowjob, her lips and tongue working in tandem to bring him intense pleasure."
"NibblesBlowjob2-3","Nibblesblowjob2_S3","{actor0} is standing with his feet on the ground, holding {actor1}'s head in place as she kneels before him, her mouth wrapped around his cock in a deepthroat blowjob, his hips thrusting forward as he takes an active role in the oral sex act."
"NibblesBlowjob2-4","Nibblesblowjob2_S4","{actor0} stands with his feet on the ground, holding {actor1}'s head in his hands as she sits with her feet on the ground, her mouth wrapped around his cock, deepthroating him."
"NibblesBlowjob2-5","Nibblesblowjob2_S5","{actor0} is standing with his feet on the ground, climaxing, as {actor1} sits in front of him, her mouth wrapped around his throbbing cock, giving him a passionate blowjob. At the same time, {actor0} has his hand on the back of {actor1}'s head, gently holding it in place as she sucks him off, her vulva visible beneath her."
"NibblesCowgirl3-1","NibblesCowgirl3_S1","{actor1} is riding {actor0} in a cowgirl position, her vulva sliding up and down on his shaft as she takes control, simultaneously nibbling on his neck, while {actor0} lies back, enjoying the sensation, his penis deep inside her."
"NibblesCowgirl3-2","NibblesCowgirl3_S2","{actor1} is sitting on top of {actor0}, who is lying back on the bottom, as she straddles him in a cowgirl position, her vulva enveloping his erect penis, while she nibbles on his skin, actively riding him in a passionate vaginal sex act."
"NibblesCowgirl3-3","NibblesCowgirl3_S3","{actor1} is riding {actor0} in a cowgirl position, her vulva enveloping his erection as she nibbles on his chest, while {actor0} lies back, taking it in, with {actor1} on top, her body positioned over his in a squatting all-fours stance."
"NibblesCowgirl3-4","NibblesCowgirl3_S4","{actor0} lies back on the bottom, climaxing, as {actor1} mounts him in a cowgirl position, her body transitioning into a sensual rhythm. With her legs straddling his hips, she's on all fours, taking the reins and actively riding him, their bodies engaging in passionate vaginal sex, both of them reaching a thrilling orgasm."
"NibblesCowgirl4-1","NibblesCowgirl4_S1","{actor1} is sitting on top of {actor0}, who's lying back on the bottom, as she rides him in a cowgirl position, her vulva enveloping his erect penis, while she simultaneously nibbles on his skin, actively controlling the vaginal sex as she bounces up and down on him."
"NibblesCowgirl4-2","NibblesCowgirl4_S2","{actor0} lies back on the bottom, as {actor1} sits on top of him, her vulva wrapped around his penis in a sensuous cowgirl pose, nibbling his skin as they engage in a passionate vaginal sex act, with {actor0} holding {actor1}'s arm, and {actor1} taking the lead in their intimate dance."
"NibblesCowgirl4-3","NibblesCowgirl4_S3","{actor1} is sitting on top of {actor0}, who's lying back on the bottom, as she rides him in a cowgirl position. {actor0} wraps his arms around {actor1}'s body, holding her close as she actively grinds against him, their vulva and penis moving in sync in a passionate and intimate vaginal sex act."
"NibblesCowgirl4-4","NibblesCowgirl4_S4","{actor1} is sitting on top of {actor0}, who's lying back on the bottom, as she rides him in a cowgirl position, their bodies engaged in passionate vaginal sex, with {actor1} taking the lead as the active performer, her vulva wrapped around {actor0}'s erect penis, while she nibbles on his skin, heightening the erotic intensity of the moment."
"NibblesCowgirl4-5","NibblesCowgirl4_S5","{actor0} lies back on the bottom, his cock thrusting upwards as {actor1} sits on top of him in a cowgirl position, her vulva enveloping his shaft as she takes control of the rhythm, both of them climaxing in unison. As they reach the peak, {actor1} nibbles on {actor0}'s chest, her hands grasping his body, holding him close as they ride out the orgasm together."
"NibblesCowgirl5-1","NibblesCowgirl5_S1","{actor1} is sitting on top of {actor0}, who's lying back on the bottom, as she rides him in a lusty cowgirl position, her vulva engulfing his erect shaft, while she nibbles on his ear, actively grinding her hips to create a sensual rhythm."
"NibblesCowgirl5-2","NibblesCowgirl5_S2","{actor1} is sitting on top of {actor0}, who's lying back, in a classic cowgirl position. She's actively grinding her vulva on his erect penis as she nibbles on his ear, the two engaged in passionate vaginal sex."
"NibblesCowgirl5-3","NibblesCowgirl5_S3","{actor1} straddles {actor0}, sitting on top of him as he lies back, her vulva grinding against his erect cock as she takes control of the vaginal sex, actively riding him in a thrilling cowgirl position, meanwhile nibbling on his ear or neck, adding to the sensual delight."
"NibblesMissionary2-4","Nibblesmissionary2_S4","{actor0} is on top of {actor1}, in a missionary position, with {actor1} lying back as {actor0} mounts her, his penis penetrating her vulva in a sensual, sexual vaginalsex act. As they move in unison, they share a tender moment, holding hands, their fingers intertwined in a romantic gesture."
"NibblesMissionary3-1","Nibblesmissionary3_S1","{actor0} is kneeling between {actor1}'s legs, his penis grinding against her vulva in a sensual missionary position, as he Tenderly holds her thigh with one hand, his fingers wrapped gently around her skin."
"NibblesMissionary3-2","Nibblesmissionary3_S2","{actor0} is kneeling between {actor1}'s legs as she lies back, his cock thrusting into her pussy in a passionate missionary position, while he gently holds her leg, nibbling on her skin, heightening their intimate connection."
"NibblesMissionary3-3","Nibblesmissionary3_S3","{actor0} is on top of {actor1}, mounting her in a missionary position, his knees spread wide as he supports himself on all fours. As he thrusts into her, his penis sinking deep into her vulva, {actor1} lies back, her body receptive to his advances, the two of them engaging in passionate vaginal sex."
"NibblesMissionary3-4","Nibblesmissionary3_S4","{actor0} is on top of {actor1}, in a missionary position, with {actor1} lying back beneath him. As they engage in passionate vaginal sex, {actor0} nibbles on {actor1}'s skin, while they share a tender, sensual hug, with {actor0} wrapping his arms around {actor1} and {actor1} reciprocating the embrace."
"NibblesMissionary3-5","Nibblesmissionary3_S5","{actor0} is on top of {actor1}, in a missionary position, with his penis inside her vulva, as they engage in vaginal sex. Both {actor0} and {actor1} are climaxing, their bodies entwined in a sensual hug, with {actor0} wrapping his arms around {actor1} and {actor1} reciprocating the embrace, nibbling on each other's skin."
"NibblesMissionary4-1","Nibblesmissionary4_S1","{actor0} is on top of {actor1}, who's lying on her back, as they go at it in a missionary position, with {actor0} grinding his cock into {actor1}'s pussy. Meanwhile, {actor1} gently holds {actor0}'s head, as {actor0} nibbles on her skin."
"NibblesMissionary4-2","Nibblesmissionary4_S2","{actor0} is on all fours, while {actor1} is lying back beneath him, her legs wrapped around his waist as they engage in a passionate missionary-style vaginal sex act, with {actor0}'s throbbing cock penetrating {actor1}'s wet pussy, the sexual tension building between them as they move in sync, {actor0} gently nibbling on {actor1}'s neck and shoulder."
"NibblesMissionary4-3","Nibblesmissionary4_S3","{actor0} kneels between {actor1}'s legs as she lies back, his erection buried deep inside her vulva in a passionate missionary position, her body wrapped in his embrace as he holds her close, his mouth nibbling on her skin, his thrusts slow and sensual, their bodies entwined in a heated sexual connection."
"NibblesMissionary4-4","Nibblesmissionary4_S4","{actor0} is kneeling between {actor1}'s legs as she lies back, his dick thrusting into her pussy in a sensual missionary position, while he holds her leg in a gentle grasp, his mouth nibbling on her skin."
"NibblesMissionary4-5","Nibblesmissionary4_S5","{actor0} is kneeling, his body rigid as he's climaxing, his dick thrusting inside {actor1}'s pussy in a missionary position, while she's lying back, her body shuddering as she reaches orgasm. At the same time, {actor0} is holding {actor1}'s leg, his hand gripping her thigh as he nibbles on her skin, their bodies transitioning into a moment of intense pleasure."
"NibblesReversecowgirl2-1","Nibblesreversecowgirl2_S1","{actor0} lies back, his body beneath {actor1}'s, as she sits on top of him in a reverse cowgirl position, her feet planted firmly on the ground, facing away from him. Meanwhile, {actor0}'s hand wraps around {actor1}'s arm, holding it in place, as he penetrates her vulva with his penis, their bodies moving in sync in a passionate, sexual rhythm."
"NibblesReversecowgirl2-2","Nibblesreversecowgirl2_S2","{actor0} sits on the bottom, while {actor1} kneels on top of him, facing away in a reverse cowgirl position. As they engage in vaginal sex, {actor0} uses his hand to hold onto {actor1}'s body, his penis deeply penetrating her vulva."
"NibblesReversecowgirl2-3","Nibblesreversecowgirl2_S3","{actor1} is squatting on top of {actor0}, who's lying back on the bottom, with her feet firmly planted on the ground and her back to him as they engage in passionate vaginal sex, his cock thrusting into her pussy. Meanwhile, she nibbles on his chest, adding an extra layer of intimacy to their reverse cowgirl position."
"NibblesReversecowgirl2-4","Nibblesreversecowgirl2_S4","{actor1} is riding {actor0} in a reverse cowgirl position, her knees straddling his hips as she faces away from him, her vulva enveloping his penis in a sensual, sexual dance, while she nibbles on his chest, as {actor0} lies back, enjoying the intense pleasure."
"NibblesReversecowgirl2-5","Nibblesreversecowgirl2_S5","{actor1} is kneeling on top of {actor0}, facing away from him, in a reverse cowgirl position, as she nibbles on his chest. Meanwhile, {actor0} lies back on the bottom, his penis penetrating {actor1}'s vulva in a passionate vaginal sex act."
"NibblesReversecowgirl2-6","Nibblesreversecowgirl2_S6","{actor0} lies back on the bottom, his cock thrusting upwards as {actor1} straddles him in a reverse cowgirl position, her vulva grinding against his erection as she kneels facing away from him. Both {actor0} and {actor1} reach a frenzied orgasm, their bodies shuddering in unison as they climax, with {actor1} nibbling on her lip in ecstasy."
"NibblesScrew-1","NibblesScrew_S1","{actor0} is kneeling between {actor1}'s spread legs, holding her leg in place as he thrusts his cock into her pussy in a missionary position, nibbling on her skin as they engage in passionate vaginal sex."
"NibblesScrew-2","NibblesScrew_S2","{actor0} is kneeling between {actor1}'s spread legs, facing her backside as he thrusts his cock into her pussy in a sensual missionary-style vaginalsex. He's got a firm grip on her leg, holding it in place as he nibbles on her skin, {actor1} lying on her side, facing away from him."
"NibblesScrew-3","NibblesScrew_S3","{actor0} is kneeling between {actor1}'s spread legs as she lies on her side, his dick thrusting into her pussy in a sensual missionary position, while he gently holds her leg, his mouth nibbling on her skin."
"NibblesScrew-4","NibblesScrew_S4","{actor0} is kneeling between {actor1}'s legs as they lie back, his penis deeply penetrating her vulva in a passionate missionary position, while he gently grips her thigh with one hand."
"NibblesSoloFHub","\N","{actor0} is standing with her feet shoulder-width apart on the ground, looking anticipatory as she awaits her next encounter."
"NibblesSidewaysfuck-1","NibblesSidewaysFuck_S1","{actor0} lies on his side, his feet planted firmly on the ground, as he's buried deep inside {actor1}'s pussy, his cock thrusting in and out of her vulva in a smooth, sensual rhythm, while {actor1} lies on her side, her body wrapped around his, her legs entwined with his, the two of them moving in perfect harmony."
"NibblesSidewaysfuck-2","NibblesSidewaysFuck_S2","{actor0} and {actor1} are lying side by side, with {actor0}'s feet planted firmly on the ground. As they engage in passionate vaginal sex, {actor0}'s hands roam {actor1}'s body, sensually groping her breasts and butt, while {actor1} receives his thrusts, their bodies entwined in a intimate embrace."
